{"active_content_sha256":"0ca629b237a303d570cf24c422ec340ba827ef25cf960f77b9f83e995bb12d1a","active_derivation_id":"drv_41f539626e32c8c2f5d261676d848ced36b591fdf0b506e1bcada9c2c94d6da2","adoption_events":[],"byte_size":32,"created_at":"2026-09-04T12:00:00Z","current_raw_path":"prior-standard.txt","derivations":{"drv_41f539626e32c8c2f5d261676d848ced36b591fdf0b506e1bcada9c2c94d6da2":{"anchors":[{"kind":"line","value":"1"}],"config_sha256":"d0a4588c7482b701f1467792de45fb47d16f8b82c662f71a16090bb71395a11b","created_at":"2026-09-04T12:00:00Z","derivation_id":"drv_41f539626e32c8c2f5d261676d848ced36b591fdf0b506e1bcada9c2c94d6da2","extractor_id":"text","extractor_version":"2+1d0ea45c86897a271a8c51ad0961cc6d880ccda62156caf65b541aece8788846","method":"deterministic","method_metadata":{"converter_id":"builtin.text","converter_version":"builtin:builtin.text:2"},"output_byte_size":53,"output_mtime_ns":1725451200000000000,"output_path":"sources/extracted/prior-standard.txt/0ca629b237a303d570cf24c422ec340ba827ef25cf960f77b9f83e995bb12d1a/drv_41f539626e32c8c2f5d261676d848ced36b591fdf0b506e1bcada9c2c94d6da2.md","output_sha256":"907788afaa5ca79242f6778be2af9143cdb4b4763e2949238b86e6006860049d","quality_state":"ok","source_sha256":"0ca629b237a303d570cf24c422ec340ba827ef25cf960f77b9f83e995bb12d1a"}},"diagnostics":[],"inspected_at":"2026-09-04T12:00:00Z","last_attempt":null,"media_type":"text/plain","previous_raw_paths":[],"schema_version":1,"source_id":"src_5fe1d396dee382c793641a395a5564ab5b26150d73937dcddfb833e527142a4d","state":"ok","updated_at":"2026-09-04T12:00:00Z","url_descriptor":null,"versions":{"0ca629b237a303d570cf24c422ec340ba827ef25cf960f77b9f83e995bb12d1a":{"byte_size":32,"fingerprint":{"byte_size":32,"mtime_ns":1725451200000000000,"path":"prior-standard.txt"},"first_seen_at":"2026-09-04T12:00:00Z","raw_path":"prior-standard.txt","retrieval_events":[],"sha256":"0ca629b237a303d570cf24c422ec340ba827ef25cf960f77b9f83e995bb12d1a"}}}
