{"active_content_sha256":"bf5dfa71b98a4d70f61eb5a901e5f9e7b874992a4a275f9c203e8835c43302e9","active_derivation_id":null,"adoption_events":[],"byte_size":58,"created_at":"2026-09-04T00:00:00Z","current_raw_path":"unavailable.txt","derivations":{},"diagnostics":[{"code":"source_failed","details":{},"message":"src-unavailable is failed","path":null}],"inspected_at":"2026-09-04T00:00:00Z","last_attempt":null,"media_type":"text/plain","previous_raw_paths":[],"schema_version":1,"source_id":"src_27fe870ea05b0e56ea6a71fb7e88e33b57010f4014aaca9b6162fe24ff5c744b","state":"failed","updated_at":"2026-09-04T00:00:00Z","url_descriptor":null,"versions":{"bf5dfa71b98a4d70f61eb5a901e5f9e7b874992a4a275f9c203e8835c43302e9":{"byte_size":58,"fingerprint":{"byte_size":58,"mtime_ns":1,"path":"unavailable.txt"},"first_seen_at":"2026-09-04T00:00:00Z","raw_path":"unavailable.txt","retrieval_events":[],"sha256":"bf5dfa71b98a4d70f61eb5a901e5f9e7b874992a4a275f9c203e8835c43302e9"}}}
