{"active_content_sha256":"aced319834315e48754e633c406909ad4d01ffc4ab182cae7703ddd6e1ade05b","active_derivation_id":"drv_68f3f67d2f36a08b73eee408814f18a3e358910b8b6e38557988cf1c58492c03","adoption_events":[],"byte_size":38,"created_at":"2026-09-04T12:00:00Z","current_raw_path":"alpha-beta.txt","derivations":{"drv_68f3f67d2f36a08b73eee408814f18a3e358910b8b6e38557988cf1c58492c03":{"anchors":[{"kind":"line","value":"1"}],"config_sha256":"d0a4588c7482b701f1467792de45fb47d16f8b82c662f71a16090bb71395a11b","created_at":"2026-09-04T12:00:00Z","derivation_id":"drv_68f3f67d2f36a08b73eee408814f18a3e358910b8b6e38557988cf1c58492c03","extractor_id":"text","extractor_version":"2+1d0ea45c86897a271a8c51ad0961cc6d880ccda62156caf65b541aece8788846","method":"deterministic","method_metadata":{"converter_id":"builtin.text","converter_version":"builtin:builtin.text:2"},"output_byte_size":59,"output_mtime_ns":1725451200000000000,"output_path":"sources/extracted/alpha-beta.txt/aced319834315e48754e633c406909ad4d01ffc4ab182cae7703ddd6e1ade05b/drv_68f3f67d2f36a08b73eee408814f18a3e358910b8b6e38557988cf1c58492c03.md","output_sha256":"e3737710a5d891314e7d660e97b1c4affcdd79cd5e6d6151d556096ad58da813","quality_state":"ok","source_sha256":"aced319834315e48754e633c406909ad4d01ffc4ab182cae7703ddd6e1ade05b"}},"diagnostics":[],"inspected_at":"2026-09-04T12:00:00Z","last_attempt":null,"media_type":"text/plain","previous_raw_paths":[],"schema_version":1,"source_id":"src_ead55a946fe45b5596302fdc45e79f4b7b261cab00aaf02744b6edb7f528535c","state":"ok","updated_at":"2026-09-04T12:00:00Z","url_descriptor":null,"versions":{"aced319834315e48754e633c406909ad4d01ffc4ab182cae7703ddd6e1ade05b":{"byte_size":38,"fingerprint":{"byte_size":38,"mtime_ns":1725451200000000000,"path":"alpha-beta.txt"},"first_seen_at":"2026-09-04T12:00:00Z","raw_path":"alpha-beta.txt","retrieval_events":[],"sha256":"aced319834315e48754e633c406909ad4d01ffc4ab182cae7703ddd6e1ade05b"}}}
