{"active_content_sha256":"452ef237072321c8fc3a251945356ca742c99c3320c2d151c8d1b15f7c4815cf","active_derivation_id":"drv_26d45709c2e1c5a96c284e269590597f7608771946187ad74508a7f0476447ec","adoption_events":[],"byte_size":44,"created_at":"2026-09-04T00:00:00Z","current_raw_path":"exception.txt","derivations":{"drv_26d45709c2e1c5a96c284e269590597f7608771946187ad74508a7f0476447ec":{"anchors":[{"kind":"line","value":"4"}],"config_sha256":"9dc46f66262448f1fdbe0110cc638a25b4e9014ec6f257b14a20f298c4ea34ea","created_at":"2026-09-04T00:00:00Z","derivation_id":"drv_26d45709c2e1c5a96c284e269590597f7608771946187ad74508a7f0476447ec","extractor_id":"text","extractor_version":"1+1e640bc25086fea6912b90b5141234c1f73eb18cbcf072f9cde9a934f91c9eb2","method":"deterministic","method_metadata":{"converter_id":"builtin.text","converter_version":"builtin:builtin.text:1"},"output_byte_size":66,"output_mtime_ns":1,"output_path":"sources/extracted/exception.txt/452ef237072321c8fc3a251945356ca742c99c3320c2d151c8d1b15f7c4815cf/drv_26d45709c2e1c5a96c284e269590597f7608771946187ad74508a7f0476447ec.md","output_sha256":"8d14d7f336419841595df106c39e091c5c4f9a935060eb971b36597d89eeb8e3","quality_state":"ok","source_sha256":"452ef237072321c8fc3a251945356ca742c99c3320c2d151c8d1b15f7c4815cf"}},"diagnostics":[],"inspected_at":"2026-09-04T00:00:00Z","last_attempt":null,"media_type":"text/plain","previous_raw_paths":[],"schema_version":1,"source_id":"src_1062015e8f1e7bb34b7f8fda272868598099cc77edd27edfce9b2243146cd4de","state":"ok","updated_at":"2026-09-04T00:00:00Z","url_descriptor":null,"versions":{"452ef237072321c8fc3a251945356ca742c99c3320c2d151c8d1b15f7c4815cf":{"byte_size":44,"fingerprint":{"byte_size":44,"mtime_ns":1,"path":"exception.txt"},"first_seen_at":"2026-09-04T00:00:00Z","raw_path":"exception.txt","retrieval_events":[],"sha256":"452ef237072321c8fc3a251945356ca742c99c3320c2d151c8d1b15f7c4815cf"}}}
