{"active_content_sha256":"fe2d43470d64244d579014da2e87daab2fb3ff8b1abf69766d5d9fcff2447b4a","active_derivation_id":"drv_bbbbbbbbbbbbbbbbbbbbbbbbbbbbbbbbbbbbbbbbbbbbbbbbbbbbbbbbbbbbbbbb","adoption_events":[{"adopted_sha256":"fe2d43470d64244d579014da2e87daab2fb3ff8b1abf69766d5d9fcff2447b4a","approval_note":"Approved prior replacement","prior_sha256":"41680cc2584beb210d6a6309eaa9344129f02e88785c653524925cd1784f3d21","recorded_at":"2026-09-04T00:00:00Z"}],"byte_size":20,"created_at":"2026-09-04T00:00:00Z","current_raw_path":"notes/a.txt","derivations":{"drv_bbbbbbbbbbbbbbbbbbbbbbbbbbbbbbbbbbbbbbbbbbbbbbbbbbbbbbbbbbbbbbbb":{"anchors":[{"kind":"page","value":"2"}],"config_sha256":"cccccccccccccccccccccccccccccccccccccccccccccccccccccccccccccccc","created_at":"2026-09-04T00:00:00Z","derivation_id":"drv_bbbbbbbbbbbbbbbbbbbbbbbbbbbbbbbbbbbbbbbbbbbbbbbbbbbbbbbbbbbbbbbb","extractor_id":"builtin.text","extractor_version":"1","method":"deterministic","method_metadata":{"converter_id":"builtin.text","converter_version":"builtin:builtin.text:1"},"output_byte_size":40,"output_mtime_ns":1,"output_path":"sources/extracted/notes/a.txt/fe2d43470d64244d579014da2e87daab2fb3ff8b1abf69766d5d9fcff2447b4a/drv_bbbbbbbbbbbbbbbbbbbbbbbbbbbbbbbbbbbbbbbbbbbbbbbbbbbbbbbbbbbbbbbb.md","output_sha256":"ae89c2580443099a607952e9b0b63561abd261df0093b71ead25c832b8420177","quality_state":"ok","source_sha256":"fe2d43470d64244d579014da2e87daab2fb3ff8b1abf69766d5d9fcff2447b4a"},"drv_eeeeeeeeeeeeeeeeeeeeeeeeeeeeeeeeeeeeeeeeeeeeeeeeeeeeeeeeeeeeeeee":{"anchors":[{"kind":"page","value":"2"}],"config_sha256":"cccccccccccccccccccccccccccccccccccccccccccccccccccccccccccccccc","created_at":"2026-09-04T00:00:00Z","derivation_id":"drv_eeeeeeeeeeeeeeeeeeeeeeeeeeeeeeeeeeeeeeeeeeeeeeeeeeeeeeeeeeeeeeee","extractor_id":"builtin.text","extractor_version":"1","method":"deterministic","method_metadata":{"converter_id":"builtin.text","converter_version":"builtin:builtin.text:1"},"output_byte_size":42,"output_mtime_ns":1,"output_path":"sources/extracted/notes/a.txt/41680cc2584beb210d6a6309eaa9344129f02e88785c653524925cd1784f3d21/drv_eeeeeeeeeeeeeeeeeeeeeeeeeeeeeeeeeeeeeeeeeeeeeeeeeeeeeeeeeeeeeeee.md","output_sha256":"5a45c8f6967cbff499388897f4c70ca3a7a6668371ab204caf5147635136e0a2","quality_state":"ok","source_sha256":"41680cc2584beb210d6a6309eaa9344129f02e88785c653524925cd1784f3d21"}},"diagnostics":[{"code":"raw_checksum_mismatch","details":{},"message":"Replacement detected","path":null}],"inspected_at":"2026-09-04T00:00:00Z","last_attempt":null,"media_type":"text/plain","previous_raw_paths":[],"schema_version":1,"source_id":"src_19a0797cd1279e786ef242e747d37c761f733fdc1969bcbb41756c492a025af1","state":"integrity_error","updated_at":"2026-09-04T00:00:00Z","url_descriptor":null,"versions":{"41680cc2584beb210d6a6309eaa9344129f02e88785c653524925cd1784f3d21":{"byte_size":22,"fingerprint":{"byte_size":22,"mtime_ns":1,"path":"_versions/src_19a0797cd1279e786ef242e747d37c761f733fdc1969bcbb41756c492a025af1/41680cc2584beb210d6a6309eaa9344129f02e88785c653524925cd1784f3d21/a.txt"},"first_seen_at":"2026-09-04T00:00:00Z","raw_path":"_versions/src_19a0797cd1279e786ef242e747d37c761f733fdc1969bcbb41756c492a025af1/41680cc2584beb210d6a6309eaa9344129f02e88785c653524925cd1784f3d21/a.txt","retrieval_events":[],"sha256":"41680cc2584beb210d6a6309eaa9344129f02e88785c653524925cd1784f3d21"},"fe2d43470d64244d579014da2e87daab2fb3ff8b1abf69766d5d9fcff2447b4a":{"byte_size":20,"fingerprint":{"byte_size":20,"mtime_ns":1,"path":"notes/a.txt"},"first_seen_at":"2026-09-04T00:00:00Z","raw_path":"notes/a.txt","retrieval_events":[],"sha256":"fe2d43470d64244d579014da2e87daab2fb3ff8b1abf69766d5d9fcff2447b4a"}}}
