{"active_content_sha256":"8650b1f4ddb21f8a7c5ffe6ea6ecc7e1d8261a96872974cea1812d166f319987","active_derivation_id":"drv_bbbbbbbbbbbbbbbbbbbbbbbbbbbbbbbbbbbbbbbbbbbbbbbbbbbbbbbbbbbbbbbb","adoption_events":[],"byte_size":23,"created_at":"2026-09-04T00:00:00Z","current_raw_path":"early.txt","derivations":{"drv_bbbbbbbbbbbbbbbbbbbbbbbbbbbbbbbbbbbbbbbbbbbbbbbbbbbbbbbbbbbbbbbb":{"anchors":[{"kind":"line","value":"3"}],"config_sha256":"cccccccccccccccccccccccccccccccccccccccccccccccccccccccccccccccc","created_at":"2026-09-04T00:00:00Z","derivation_id":"drv_bbbbbbbbbbbbbbbbbbbbbbbbbbbbbbbbbbbbbbbbbbbbbbbbbbbbbbbbbbbbbbbb","extractor_id":"builtin.text","extractor_version":"1","method":"deterministic","method_metadata":{"converter_id":"builtin.text","converter_version":"builtin:builtin.text:1"},"output_byte_size":38,"output_mtime_ns":1,"output_path":"sources/extracted/early.txt/8650b1f4ddb21f8a7c5ffe6ea6ecc7e1d8261a96872974cea1812d166f319987/drv_bbbbbbbbbbbbbbbbbbbbbbbbbbbbbbbbbbbbbbbbbbbbbbbbbbbbbbbbbbbbbbbb.md","output_sha256":"b598606cd37711f4c9a78c9e3d28430f8c6dda2e8d33134271e5f5a4bad87c5f","quality_state":"ok","source_sha256":"8650b1f4ddb21f8a7c5ffe6ea6ecc7e1d8261a96872974cea1812d166f319987"}},"diagnostics":[],"inspected_at":"2026-09-04T00:00:00Z","last_attempt":null,"media_type":"text/plain","previous_raw_paths":[],"schema_version":1,"source_id":"src_de1e10d7c98d8e892423e1a5940dc4f0785f2c89cca114be6e3997aba2e4fa39","state":"ok","updated_at":"2026-09-04T00:00:00Z","url_descriptor":null,"versions":{"8650b1f4ddb21f8a7c5ffe6ea6ecc7e1d8261a96872974cea1812d166f319987":{"byte_size":23,"fingerprint":{"byte_size":23,"mtime_ns":1,"path":"early.txt"},"first_seen_at":"2026-09-04T00:00:00Z","raw_path":"early.txt","retrieval_events":[],"sha256":"8650b1f4ddb21f8a7c5ffe6ea6ecc7e1d8261a96872974cea1812d166f319987"}}}
