{"active_content_sha256":"6f0efb85331da483f1f4bb04427e9abedcf0e98af78c2f40a911edfa58365edc","active_derivation_id":null,"adoption_events":[{"adopted_sha256":"6f0efb85331da483f1f4bb04427e9abedcf0e98af78c2f40a911edfa58365edc","approval_note":"Approved replacement","prior_sha256":"fe2d43470d64244d579014da2e87daab2fb3ff8b1abf69766d5d9fcff2447b4a","recorded_at":"2026-09-04T00:00:00Z"}],"byte_size":19,"created_at":"2026-09-04T00:00:00Z","current_raw_path":"notes/a.txt","derivations":{"drv_bbbbbbbbbbbbbbbbbbbbbbbbbbbbbbbbbbbbbbbbbbbbbbbbbbbbbbbbbbbbbbbb":{"anchors":[{"kind":"page","value":"2"}],"config_sha256":"cccccccccccccccccccccccccccccccccccccccccccccccccccccccccccccccc","created_at":"2026-09-04T00:00:00Z","derivation_id":"drv_bbbbbbbbbbbbbbbbbbbbbbbbbbbbbbbbbbbbbbbbbbbbbbbbbbbbbbbbbbbbbbbb","extractor_id":"builtin.text","extractor_version":"1","method":"deterministic","method_metadata":{"converter_id":"builtin.text","converter_version":"builtin:builtin.text:1"},"output_byte_size":40,"output_mtime_ns":1,"output_path":"sources/extracted/notes/a.txt/fe2d43470d64244d579014da2e87daab2fb3ff8b1abf69766d5d9fcff2447b4a/drv_bbbbbbbbbbbbbbbbbbbbbbbbbbbbbbbbbbbbbbbbbbbbbbbbbbbbbbbbbbbbbbbb.md","output_sha256":"ae89c2580443099a607952e9b0b63561abd261df0093b71ead25c832b8420177","quality_state":"ok","source_sha256":"fe2d43470d64244d579014da2e87daab2fb3ff8b1abf69766d5d9fcff2447b4a"}},"diagnostics":[],"inspected_at":"2026-09-04T00:00:00Z","last_attempt":null,"media_type":"text/plain","previous_raw_paths":[],"schema_version":1,"source_id":"src_4e31593e866bff93b2f886960e05fc213d357cd0117f2a94489036d1d22cb9df","state":"pending","updated_at":"2026-09-04T00:00:00Z","url_descriptor":null,"versions":{"6f0efb85331da483f1f4bb04427e9abedcf0e98af78c2f40a911edfa58365edc":{"byte_size":19,"fingerprint":{"byte_size":19,"mtime_ns":1,"path":"notes/a.txt"},"first_seen_at":"2026-09-04T00:00:00Z","raw_path":"notes/a.txt","retrieval_events":[],"sha256":"6f0efb85331da483f1f4bb04427e9abedcf0e98af78c2f40a911edfa58365edc"},"fe2d43470d64244d579014da2e87daab2fb3ff8b1abf69766d5d9fcff2447b4a":{"byte_size":20,"fingerprint":{"byte_size":20,"mtime_ns":1,"path":"_versions/src_4e31593e866bff93b2f886960e05fc213d357cd0117f2a94489036d1d22cb9df/fe2d43470d64244d579014da2e87daab2fb3ff8b1abf69766d5d9fcff2447b4a/a.txt"},"first_seen_at":"2026-09-04T00:00:00Z","raw_path":"_versions/src_4e31593e866bff93b2f886960e05fc213d357cd0117f2a94489036d1d22cb9df/fe2d43470d64244d579014da2e87daab2fb3ff8b1abf69766d5d9fcff2447b4a/a.txt","retrieval_events":[],"sha256":"fe2d43470d64244d579014da2e87daab2fb3ff8b1abf69766d5d9fcff2447b4a"}}}
