{"active_content_sha256":"a9df17acda9a20f513419ec4b48a39b8eb5a4b15053b636c802f733859e4654f","active_derivation_id":"drv_bab90cca5df82f0188f1651699a673c5a8bbb9619bb0ed02fbf4969d7c08bee6","adoption_events":[],"byte_size":24,"created_at":"2026-09-04T12:00:00Z","current_raw_path":"alpha-2025.txt","derivations":{"drv_bab90cca5df82f0188f1651699a673c5a8bbb9619bb0ed02fbf4969d7c08bee6":{"anchors":[{"kind":"line","value":"1"}],"config_sha256":"9dc46f66262448f1fdbe0110cc638a25b4e9014ec6f257b14a20f298c4ea34ea","created_at":"2026-09-04T12:00:00Z","derivation_id":"drv_bab90cca5df82f0188f1651699a673c5a8bbb9619bb0ed02fbf4969d7c08bee6","extractor_id":"text","extractor_version":"1+1e640bc25086fea6912b90b5141234c1f73eb18cbcf072f9cde9a934f91c9eb2","method":"deterministic","method_metadata":{"converter_id":"builtin.text","converter_version":"builtin:builtin.text:1"},"output_byte_size":45,"output_mtime_ns":1725451200000000000,"output_path":"sources/extracted/alpha-2025.txt/a9df17acda9a20f513419ec4b48a39b8eb5a4b15053b636c802f733859e4654f/drv_bab90cca5df82f0188f1651699a673c5a8bbb9619bb0ed02fbf4969d7c08bee6.md","output_sha256":"5abeffeef0942f02b00a74632bdbb8329dcf3cfb8a2b7ddb43253396cec820c4","quality_state":"ok","source_sha256":"a9df17acda9a20f513419ec4b48a39b8eb5a4b15053b636c802f733859e4654f"}},"diagnostics":[],"inspected_at":"2026-09-04T12:00:00Z","last_attempt":null,"media_type":"text/plain","previous_raw_paths":[],"schema_version":1,"source_id":"src_4e432e9cf4d726196e7e1abbe2900181adaee3808636e2733b3c6de3fdfa0cc9","state":"ok","updated_at":"2026-09-04T12:00:00Z","url_descriptor":null,"versions":{"a9df17acda9a20f513419ec4b48a39b8eb5a4b15053b636c802f733859e4654f":{"byte_size":24,"fingerprint":{"byte_size":24,"mtime_ns":1725451200000000000,"path":"alpha-2025.txt"},"first_seen_at":"2026-09-04T12:00:00Z","raw_path":"alpha-2025.txt","retrieval_events":[],"sha256":"a9df17acda9a20f513419ec4b48a39b8eb5a4b15053b636c802f733859e4654f"}}}
