{"active_content_sha256":"fd25af3e32d62bbd82f09c8d7a7d355a2f4426ef0675067deb09c4064aaa1648","active_derivation_id":"drv_ac09b30de217409c3a859fc4c85bb05999b81ca80c0d36ab550a4cbf1de6023e","adoption_events":[],"byte_size":24,"created_at":"2026-09-04T12:00:00Z","current_raw_path":"alpha-2024.txt","derivations":{"drv_ac09b30de217409c3a859fc4c85bb05999b81ca80c0d36ab550a4cbf1de6023e":{"anchors":[{"kind":"line","value":"1"}],"config_sha256":"9dc46f66262448f1fdbe0110cc638a25b4e9014ec6f257b14a20f298c4ea34ea","created_at":"2026-09-04T12:00:00Z","derivation_id":"drv_ac09b30de217409c3a859fc4c85bb05999b81ca80c0d36ab550a4cbf1de6023e","extractor_id":"text","extractor_version":"1+1e640bc25086fea6912b90b5141234c1f73eb18cbcf072f9cde9a934f91c9eb2","method":"deterministic","method_metadata":{"converter_id":"builtin.text","converter_version":"builtin:builtin.text:1"},"output_byte_size":45,"output_mtime_ns":1725451200000000000,"output_path":"sources/extracted/alpha-2024.txt/fd25af3e32d62bbd82f09c8d7a7d355a2f4426ef0675067deb09c4064aaa1648/drv_ac09b30de217409c3a859fc4c85bb05999b81ca80c0d36ab550a4cbf1de6023e.md","output_sha256":"c28e24d1faf4069b9e91393ca9d3b342684aaac2b711b0796721f844029b70af","quality_state":"ok","source_sha256":"fd25af3e32d62bbd82f09c8d7a7d355a2f4426ef0675067deb09c4064aaa1648"}},"diagnostics":[],"inspected_at":"2026-09-04T12:00:00Z","last_attempt":null,"media_type":"text/plain","previous_raw_paths":[],"schema_version":1,"source_id":"src_32cfaef006a86057e22dddc66cbbb6365d0d3616d650c3454e9d49f39c6c7414","state":"ok","updated_at":"2026-09-04T12:00:00Z","url_descriptor":null,"versions":{"fd25af3e32d62bbd82f09c8d7a7d355a2f4426ef0675067deb09c4064aaa1648":{"byte_size":24,"fingerprint":{"byte_size":24,"mtime_ns":1725451200000000000,"path":"alpha-2024.txt"},"first_seen_at":"2026-09-04T12:00:00Z","raw_path":"alpha-2024.txt","retrieval_events":[],"sha256":"fd25af3e32d62bbd82f09c8d7a7d355a2f4426ef0675067deb09c4064aaa1648"}}}
