{"active_content_sha256":"7cc7e05bc8804b0f89c22b78871eff982580b6f24eb13ce37323d4c0c47835e9","active_derivation_id":"drv_bbbbbbbbbbbbbbbbbbbbbbbbbbbbbbbbbbbbbbbbbbbbbbbbbbbbbbbbbbbbbbbb","adoption_events":[],"byte_size":26,"created_at":"2026-09-04T00:00:00Z","current_raw_path":"zzz-late.txt","derivations":{"drv_bbbbbbbbbbbbbbbbbbbbbbbbbbbbbbbbbbbbbbbbbbbbbbbbbbbbbbbbbbbbbbbb":{"anchors":[{"kind":"line","value":"3"}],"config_sha256":"cccccccccccccccccccccccccccccccccccccccccccccccccccccccccccccccc","created_at":"2026-09-04T00:00:00Z","derivation_id":"drv_bbbbbbbbbbbbbbbbbbbbbbbbbbbbbbbbbbbbbbbbbbbbbbbbbbbbbbbbbbbbbbbb","extractor_id":"builtin.text","extractor_version":"1","method":"deterministic","method_metadata":{"converter_id":"builtin.text","converter_version":"builtin:builtin.text:1"},"output_byte_size":41,"output_mtime_ns":1,"output_path":"sources/extracted/zzz-late.txt/7cc7e05bc8804b0f89c22b78871eff982580b6f24eb13ce37323d4c0c47835e9/drv_bbbbbbbbbbbbbbbbbbbbbbbbbbbbbbbbbbbbbbbbbbbbbbbbbbbbbbbbbbbbbbbb.md","output_sha256":"892509200b4f4a1eecb9243d1531fcd9a2752c4a72d2ca3bae03c89cb911a942","quality_state":"ok","source_sha256":"7cc7e05bc8804b0f89c22b78871eff982580b6f24eb13ce37323d4c0c47835e9"}},"diagnostics":[],"inspected_at":"2026-09-04T00:00:00Z","last_attempt":null,"media_type":"text/plain","previous_raw_paths":[],"schema_version":1,"source_id":"src_e2f0c7c443733302d82366fd6c3e3567c87f66d22ce2ea475a0151d59249fe94","state":"ok","updated_at":"2026-09-04T00:00:00Z","url_descriptor":null,"versions":{"7cc7e05bc8804b0f89c22b78871eff982580b6f24eb13ce37323d4c0c47835e9":{"byte_size":26,"fingerprint":{"byte_size":26,"mtime_ns":1,"path":"zzz-late.txt"},"first_seen_at":"2026-09-04T00:00:00Z","raw_path":"zzz-late.txt","retrieval_events":[],"sha256":"7cc7e05bc8804b0f89c22b78871eff982580b6f24eb13ce37323d4c0c47835e9"}}}
