{"active_content_sha256":"133390ba36589a8a5a8c896cab7236d2a5436c83b6758f775b0d3de528507196","active_derivation_id":"drv_d1a0d7e4ad37bcf76dddf9cc73b9b3950fddae30198d111dec027dfac18009de","adoption_events":[],"byte_size":66,"created_at":"2026-09-04T00:00:00Z","current_raw_path":"alpha.txt","derivations":{"drv_d1a0d7e4ad37bcf76dddf9cc73b9b3950fddae30198d111dec027dfac18009de":{"anchors":[{"kind":"line","value":"4"}],"config_sha256":"9dc46f66262448f1fdbe0110cc638a25b4e9014ec6f257b14a20f298c4ea34ea","created_at":"2026-09-04T00:00:00Z","derivation_id":"drv_d1a0d7e4ad37bcf76dddf9cc73b9b3950fddae30198d111dec027dfac18009de","extractor_id":"text","extractor_version":"1+1e640bc25086fea6912b90b5141234c1f73eb18cbcf072f9cde9a934f91c9eb2","method":"deterministic","method_metadata":{"converter_id":"builtin.text","converter_version":"builtin:builtin.text:1"},"output_byte_size":88,"output_mtime_ns":1,"output_path":"sources/extracted/alpha.txt/133390ba36589a8a5a8c896cab7236d2a5436c83b6758f775b0d3de528507196/drv_d1a0d7e4ad37bcf76dddf9cc73b9b3950fddae30198d111dec027dfac18009de.md","output_sha256":"92af7f99b00b123c2ce04c4aca2ced33c6b664ddf5257a924c0d1549b9056f9b","quality_state":"ok","source_sha256":"133390ba36589a8a5a8c896cab7236d2a5436c83b6758f775b0d3de528507196"}},"diagnostics":[],"inspected_at":"2026-09-04T00:00:00Z","last_attempt":null,"media_type":"text/plain","previous_raw_paths":[],"schema_version":1,"source_id":"src_0b07c1a90cd7fda7dacb804718961b3d27739f3d725e0925cb555e92a7835772","state":"ok","updated_at":"2026-09-04T00:00:00Z","url_descriptor":null,"versions":{"133390ba36589a8a5a8c896cab7236d2a5436c83b6758f775b0d3de528507196":{"byte_size":66,"fingerprint":{"byte_size":66,"mtime_ns":1,"path":"alpha.txt"},"first_seen_at":"2026-09-04T00:00:00Z","raw_path":"alpha.txt","retrieval_events":[],"sha256":"133390ba36589a8a5a8c896cab7236d2a5436c83b6758f775b0d3de528507196"}}}
