{"active_content_sha256":"5a3c9123da6f3257e3a0c66d328a49953892eda74d9d8f292de518f4816fabef","active_derivation_id":"drv_137cab0fbef06bd497a00f2bdd8b9065ee52cd800a786ea4cee25967a48db883","adoption_events":[],"byte_size":33,"created_at":"2026-09-04T12:00:00Z","current_raw_path":"alpha.txt","derivations":{"drv_137cab0fbef06bd497a00f2bdd8b9065ee52cd800a786ea4cee25967a48db883":{"anchors":[{"kind":"line","value":"1"}],"config_sha256":"9dc46f66262448f1fdbe0110cc638a25b4e9014ec6f257b14a20f298c4ea34ea","created_at":"2026-09-04T12:00:00Z","derivation_id":"drv_137cab0fbef06bd497a00f2bdd8b9065ee52cd800a786ea4cee25967a48db883","extractor_id":"text","extractor_version":"1+1e640bc25086fea6912b90b5141234c1f73eb18cbcf072f9cde9a934f91c9eb2","method":"deterministic","method_metadata":{"converter_id":"builtin.text","converter_version":"builtin:builtin.text:1"},"output_byte_size":54,"output_mtime_ns":1725451200000000000,"output_path":"sources/extracted/alpha.txt/5a3c9123da6f3257e3a0c66d328a49953892eda74d9d8f292de518f4816fabef/drv_137cab0fbef06bd497a00f2bdd8b9065ee52cd800a786ea4cee25967a48db883.md","output_sha256":"4f6b66e1cfb6594f4c1298e0593c9e9e18e1d52becf1c9d5a6250c9fc37ebf6e","quality_state":"ok","source_sha256":"5a3c9123da6f3257e3a0c66d328a49953892eda74d9d8f292de518f4816fabef"}},"diagnostics":[],"inspected_at":"2026-09-04T12:00:00Z","last_attempt":null,"media_type":"text/plain","previous_raw_paths":[],"schema_version":1,"source_id":"src_bca30194d76672b62f7d7dc448c07116a67dadb8aca40fb8e9ddc9177dd28a7b","state":"ok","updated_at":"2026-09-04T12:00:00Z","url_descriptor":null,"versions":{"5a3c9123da6f3257e3a0c66d328a49953892eda74d9d8f292de518f4816fabef":{"byte_size":33,"fingerprint":{"byte_size":33,"mtime_ns":1725451200000000000,"path":"alpha.txt"},"first_seen_at":"2026-09-04T12:00:00Z","raw_path":"alpha.txt","retrieval_events":[],"sha256":"5a3c9123da6f3257e3a0c66d328a49953892eda74d9d8f292de518f4816fabef"}}}
