{"active_content_sha256":"fe2d43470d64244d579014da2e87daab2fb3ff8b1abf69766d5d9fcff2447b4a","active_derivation_id":"drv_bbbbbbbbbbbbbbbbbbbbbbbbbbbbbbbbbbbbbbbbbbbbbbbbbbbbbbbbbbbbbbbb","adoption_events":[],"byte_size":20,"created_at":"2026-09-04T00:00:00Z","current_raw_path":"notes/a.txt","derivations":{"drv_bbbbbbbbbbbbbbbbbbbbbbbbbbbbbbbbbbbbbbbbbbbbbbbbbbbbbbbbbbbbbbbb":{"anchors":[{"kind":"page","value":"2"}],"config_sha256":"cccccccccccccccccccccccccccccccccccccccccccccccccccccccccccccccc","created_at":"2026-09-04T00:00:00Z","derivation_id":"drv_bbbbbbbbbbbbbbbbbbbbbbbbbbbbbbbbbbbbbbbbbbbbbbbbbbbbbbbbbbbbbbbb","extractor_id":"builtin.text","extractor_version":"1","method":"deterministic","method_metadata":{"converter_id":"builtin.text","converter_version":"builtin:builtin.text:1"},"output_byte_size":40,"output_mtime_ns":1,"output_path":"sources/extracted/notes/a.txt/fe2d43470d64244d579014da2e87daab2fb3ff8b1abf69766d5d9fcff2447b4a/drv_bbbbbbbbbbbbbbbbbbbbbbbbbbbbbbbbbbbbbbbbbbbbbbbbbbbbbbbbbbbbbbbb.md","output_sha256":"ae89c2580443099a607952e9b0b63561abd261df0093b71ead25c832b8420177","quality_state":"ok","source_sha256":"fe2d43470d64244d579014da2e87daab2fb3ff8b1abf69766d5d9fcff2447b4a"}},"diagnostics":[],"inspected_at":"2026-09-04T00:00:00Z","last_attempt":null,"media_type":"text/plain","previous_raw_paths":[],"schema_version":1,"source_id":"src_4e31593e866bff93b2f886960e05fc213d357cd0117f2a94489036d1d22cb9df","state":"ok","updated_at":"2026-09-04T00:00:00Z","url_descriptor":null,"versions":{"fe2d43470d64244d579014da2e87daab2fb3ff8b1abf69766d5d9fcff2447b4a":{"byte_size":20,"fingerprint":{"byte_size":20,"mtime_ns":1,"path":"notes/a.txt"},"first_seen_at":"2026-09-04T00:00:00Z","raw_path":"notes/a.txt","retrieval_events":[],"sha256":"fe2d43470d64244d579014da2e87daab2fb3ff8b1abf69766d5d9fcff2447b4a"}}}
