{"active_content_sha256":"e60dd87d1ca3d7400d80aec2ef452de203d3983c3e007e5fda7a10ad3606fe96","active_derivation_id":"drv_bbbbbbbbbbbbbbbbbbbbbbbbbbbbbbbbbbbbbbbbbbbbbbbbbbbbbbbbbbbbbbbb","adoption_events":[],"byte_size":41,"created_at":"2026-09-04T00:00:00Z","current_raw_path":"unusual/r\u00e9sum\u00e9 (final).md","derivations":{"drv_bbbbbbbbbbbbbbbbbbbbbbbbbbbbbbbbbbbbbbbbbbbbbbbbbbbbbbbbbbbbbbbb":{"anchors":[{"kind":"line","value":"3"}],"config_sha256":"cccccccccccccccccccccccccccccccccccccccccccccccccccccccccccccccc","created_at":"2026-09-04T00:00:00Z","derivation_id":"drv_bbbbbbbbbbbbbbbbbbbbbbbbbbbbbbbbbbbbbbbbbbbbbbbbbbbbbbbbbbbbbbbb","extractor_id":"builtin.text","extractor_version":"1","method":"deterministic","method_metadata":{"converter_id":"builtin.text","converter_version":"builtin:builtin.text:1"},"output_byte_size":56,"output_mtime_ns":1,"output_path":"sources/extracted/unusual/r\u00e9sum\u00e9 (final).md/e60dd87d1ca3d7400d80aec2ef452de203d3983c3e007e5fda7a10ad3606fe96/drv_bbbbbbbbbbbbbbbbbbbbbbbbbbbbbbbbbbbbbbbbbbbbbbbbbbbbbbbbbbbbbbbb.md","output_sha256":"fe3ed304d2f5c13654aea038c34113719d62318c12124ef594060704d0fb894e","quality_state":"ok","source_sha256":"e60dd87d1ca3d7400d80aec2ef452de203d3983c3e007e5fda7a10ad3606fe96"}},"diagnostics":[],"inspected_at":"2026-09-04T00:00:00Z","last_attempt":null,"media_type":"text/plain","previous_raw_paths":[],"schema_version":1,"source_id":"src_50390b482e48dad5581557fc514f94981a3d7f5f02322b2848fc80d7dd6d0f39","state":"ok","updated_at":"2026-09-04T00:00:00Z","url_descriptor":null,"versions":{"e60dd87d1ca3d7400d80aec2ef452de203d3983c3e007e5fda7a10ad3606fe96":{"byte_size":41,"fingerprint":{"byte_size":41,"mtime_ns":1,"path":"unusual/r\u00e9sum\u00e9 (final).md"},"first_seen_at":"2026-09-04T00:00:00Z","raw_path":"unusual/r\u00e9sum\u00e9 (final).md","retrieval_events":[],"sha256":"e60dd87d1ca3d7400d80aec2ef452de203d3983c3e007e5fda7a10ad3606fe96"}}}
